{
  "as_of": "2026-09-24T07:00:00+03:00",
  "stale_after_sec": 3600,
  "horizon_until": "2026-10-01",
  "sections": [
    {
      "exchange": "MISX",
      "section": "stock",
      "days": [
        {"date": "2026-09-24", "is_traded": true, "kind": "N", "trade_session_date": "2026-09-24"},
        {"date": "2026-09-25", "is_traded": true, "kind": "N", "trade_session_date": "2026-09-25"},
        {"date": "2026-09-26", "is_traded": true, "kind": "W", "trade_session_date": "2026-09-28"},
        {"date": "2026-09-27", "is_traded": false, "kind": "H", "trade_session_date": null},
        {"date": "2026-09-28", "is_traded": true, "kind": "N", "trade_session_date": "2026-09-28"},
        {"date": "2026-12-31", "is_traded": false, "kind": "H", "trade_session_date": null}
      ],
      "windows": [
        {"board": "TQBR", "start": "2026-09-24T06:50:00+03:00", "end": "2026-09-24T06:59:30+03:00", "phase": "opening_auction", "estimated": false},
        {"board": "TQBR", "start": "2026-09-24T07:00:00+03:00", "end": "2026-09-24T08:59:59+03:00", "phase": "morning", "estimated": false},
        {"board": "TQBR", "start": "2026-09-24T09:00:00+03:00", "end": "2026-09-24T18:54:59+03:00", "phase": "main", "estimated": false},
        {"board": "TQBR", "start": "2026-09-24T18:55:00+03:00", "end": "2026-09-24T18:57:29+03:00", "phase": "closing_auction", "estimated": false},
        {"board": "TQBR", "start": "2026-09-24T18:57:30+03:00", "end": "2026-09-24T18:59:59+03:00", "phase": "closing_price", "estimated": false},
        {"board": "TQBR", "start": "2026-09-24T19:00:01+03:00", "end": "2026-09-24T23:49:59+03:00", "phase": "evening", "estimated": false},
        {"start": "2026-09-26T10:00:00+03:00", "end": "2026-09-26T19:00:00+03:00", "phase": "weekend", "estimated": true}
      ]
    },
    {
      "exchange": "MISX",
      "section": "futures",
      "days": [
        {"date": "2026-09-24", "is_traded": true, "kind": "N", "trade_session_date": "2026-09-24"},
        {"date": "2026-09-25", "is_traded": true, "kind": "N", "trade_session_date": "2026-09-25"},
        {"date": "2026-09-26", "is_traded": true, "kind": "W", "trade_session_date": "2026-09-28"},
        {"date": "2026-09-27", "is_traded": false, "kind": "H", "trade_session_date": null},
        {"date": "2026-09-28", "is_traded": true, "kind": "N", "trade_session_date": "2026-09-28"},
        {"date": "2026-12-31", "is_traded": false, "kind": "H", "trade_session_date": null}
      ],
      "windows": [
        {"start": "2026-09-24T07:00:00+03:00", "end": "2026-09-24T09:00:00+03:00", "phase": "morning", "estimated": false},
        {"start": "2026-09-24T09:00:00+03:00", "end": "2026-09-24T19:00:00+03:00", "phase": "main", "estimated": false},
        {"start": "2026-09-24T19:00:00+03:00", "end": "2026-09-24T23:50:00+03:00", "phase": "evening", "estimated": false},
        {"start": "2026-09-25T07:00:00+03:00", "end": "2026-09-25T09:00:00+03:00", "phase": "morning", "estimated": true},
        {"start": "2026-09-25T09:00:00+03:00", "end": "2026-09-25T19:00:00+03:00", "phase": "main", "estimated": true},
        {"start": "2026-09-25T19:00:00+03:00", "end": "2026-09-25T23:50:00+03:00", "phase": "evening", "estimated": true}
      ]
    },
    {
      "exchange": "MISX",
      "section": "currency",
      "days": [
        {"date": "2026-09-24", "is_traded": true, "kind": "N", "trade_session_date": "2026-09-24"},
        {"date": "2026-09-25", "is_traded": true, "kind": "N", "trade_session_date": "2026-09-25"},
        {"date": "2026-09-26", "is_traded": false, "kind": "H", "trade_session_date": null},
        {"date": "2026-09-27", "is_traded": false, "kind": "H", "trade_session_date": null},
        {"date": "2026-09-28", "is_traded": true, "kind": "N", "trade_session_date": "2026-09-28"},
        {"date": "2026-12-31", "is_traded": false, "kind": "H", "trade_session_date": null}
      ],
      "windows": [
        {"board": "CETS", "start": "2026-09-24T09:00:00+03:00", "end": "2026-09-24T19:00:00+03:00", "phase": "main", "estimated": false}
      ]
    }
  ]
}
